### ISSUE TITLE
qlogfetch2设计文档草稿

### ISSUE THREAD

**Issue by peteryuanpan** [peteryuanpan/notebook#172]
qlogfetch2

功能
1. 完全具备qlogfetch的功能
  1.1 reg，设置当前用户ak sk from（from=qiniu|aliyun）
  1.2 info，显示当前设置的ak sk from
  1.3 listlog 列出指定日期，指定域名的日志文件列表
  1.4 downlog 下载指定日期，指定域名下的所有日志文件
  1.5 domains 查询账户下的所有域名
2. 除了七牛云日志外，支持listlog、downlog、domains阿里云日志
3. 支持按小时粒度listlog、downlog日志
4. 支持多线程下载，-worker worker

总结
- 代码及文档已上传：https://github.com/peteryuanpan/qlogfetch2

**Comment by peteryuanpan** [comment]
核心类
- class Main，负责处理参数，转发到具体Command实例，或者报错
- interface CommandInterface，命令类的抽象
- class CommandHelp，负责处理 -h 命令
- class CommandReg，负责校验参数，转发到ExecuteReg
- class CommandInfo，负责校验参数，转发到ExecuteInfo
- class CommandListLog，负责校验参数，转发到ExecuteListLog
- class CommandDownLog，负责校验参数，转发到ExecuteDownLog
- class CommandDomains，负责校验参数，转发到ExecuteDomains
- class CommandFactory，负责生成CommanInterface派生类的实例
- class ExecuteReg，负责将ak sk from以json格式输出到本地文件夹下 .qlogfetch2\account.json 文件中
- class ExecuteInfo，负责读取本地文件夹下 .qlogfetch2\account.json 文件，输出ak sk from到控制台中
- class ExecuteListLog，负责接收CommandListLog的请求，转发到具体ExecuteListLogInterface实例
- interface ExecuteListLogInterface，负责列出指定日期，指定域名的日志文件列表，输出到控制台中
- class ExecuteListLogQiniu，负责ExecuteListLogInterface七牛云的具体执行
- class ExecuteListLogAliyun，负责ExecuteListLogInterface阿里云的具体执行
- class ExecuteDownLog，负责接收CommandDownLog的请求，转发到具体ExecuteDownLogInterface实例
- interface ExecuteDownLogInterface，负责下载指定日期，指定域名下的所有日志文件，支持多线程下载
- abstract class ExecuteDownLogAbstract，负责ExecuteDownLogInterface的抽象执行
- class ExecuteDownLogQiniu，负责ExecuteDownLogInterface七牛云的具体执行
- class ExecuteDownLogAliyun，负责ExecuteDownLogInterface阿里云的具体执行
- class ExecuteDomains，负责接收CommandDomains的请求，转发到具体ExecuteDomainsInterface实例
- interface ExecuteDomainsInterface，负责查询账户下所有域名，输出到控制台中
- class ExecuteDomainsQiniu，负责ExecuteDomainsInterface七牛云的具体执行
- class ExecuteDomainsAliyun，负责ExecuteDomainsInterface阿里云的具体执行
- class ExecuteHttp，负责发送http请求
- class Auth，负责签算token
- class AuthQiniu，负责签算七牛token
- class AuthAliyun，负责签算阿里token

设计模式
- 策略模式
- 模板方法
- 工厂模式
- 单例模式

八大原则
- 依赖倒置原则：高层模块与低层模块都应该依赖于抽象
- 开放封闭原则：对扩展开放对更改封闭
- 单一职责原则：一个类应该仅有一个原因引起它变化
- 里氏替换原则：子类必须能够替换基类
- 接口隔离原则：接口应该小而完备
- 优先使用对象组合而不是类继承
- 针对接口编程而不是针对实现编程
- 封装变化点

**Comment by peteryuanpan** [comment]
```
qlogfetch_windows_amd64.exe
QLogFetch 1.0.6

Supported commands:
       reg      set access key and secret key
      info      show access key and secret key
   listlog      list the log files of domains of a date
   downlog      donwload all the log files of domains of a date
   domains      list all the domains under this account

qlogfetch_windows_amd64.exe reg
Usage: qlogfetch reg -ak <AccessKey> -sk <SecretKey>
        set access key and secret key
        example: qlogfetch reg -ak 'your access key' -sk 'your secret key'

qlogfetch_windows_amd64.exe reg -ak xxx -sk yyy
Write account info to D:\download\qlogfetch-v1.0.6\.qlogfetch\account.json

qlogfetch_windows_amd64.exe info
Please use `reg` to set AccessKey and SecretKey first

qlogfetch_windows_amd64.exe info
Load account info from D:\download\qlogfetch-v1.0.6\.qlogfetch\account.json
AccessKey: xxx SecretKey: yyy

qlogfetch_windows_amd64.exe listlog
Usage: qlogfetch [-pretty] -date <Date> -domains <Domains>
        list the log files of domains of a date
        example: qlogfetch listlog -date '2016-11-23' -domains 'img.abc.com;video.abc.com'

qlogfetch_windows_amd64.exe listlog -date "2020-12-05" -domains "tswork.peterpy.cn"
Wrong domain or no log of the domain at the date

D:\download\qlogfetch-v1.0.6>qlogfetch_windows_amd64.exe listlog -date "2020-12-01" -domains "dn-odum9helk.qbox.me"
v2/dn-odum9helk.qbox.me_2020-12-01-00_part-00000.gz     134277972       1606769981      https://fusionlog.qiniu.com/v2/dn-odum9helk.qbox.me_2020-12-01-00_part-00000.gz?e=1611953941&token=557TpseUM8ovpfUhaw8gfa2DQ0104ZScM-BTIcBx:NNcyiGwp3VKNHzDynM2Wdw4WO9I=

D:\download\qlogfetch-v1.0.6>qlogfetch_windows_amd64.exe listlog -date "2020-12-01" -domains "dn-odum9helk.qbox.me" -pretty
v2/dn-odum9helk.qbox.me_2020-12-01-23_part-00017.gz     13.00 MB        2020-12-02 04:09:14 +0800 CST   https://fusionlog.qiniu.com/v2/dn-odum9helk.qbox.me_2020-12-01-23_part-00017.gz?e=1612037354&token=557TpseUM8ovpfUhaw8gfa2DQ0104ZScM-BTIcBx:wrjGGdSFWFvbKFEod1mwbtqyhm4=

qlogfetch_windows_amd64.exe downlog
Usage: qlogfetch downlog -date <Date> -domains <Domains> -dest <DestDir> -worker <Worker>
        donwload all the log files of domains of a date
        example: qlogfetch downlog -date '2016-11-23' -domains 'img.abc.com;video.abc.com' -dest '/tmp/logs'

qlogfetch_windows_amd64.exe domains
123.baidu.com
17ipc.qnssl.com
20190614-test.peterpy.cn
```

**Comment by peteryuanpan** [comment]
测试结果
```
nThreads: 1
Total size: 364.95MB
Total time cost: 76.88 second

nThreads: 50
Total size: 364.95MB
Total time cost: 24.99 second

nThreads: 100
Total size: 364.95MB
Total time cost: 27.87 second

nThreads: 300
Total size: 364.95MB
Total time cost: 178.34 second
```

**Comment by peteryuanpan** [comment]
记录
- [JAVA网络请求--------Okhttp3](https://www.cnblogs.com/lxlw/p/11767888.html)
- [OkHttp使用踩坑记录总结(一)：OkHttpClient单例和长连接Connection Keep-Alive](https://blog.csdn.net/sinat_36553913/article/details/104054028)
- [HTTP客户端连接，选择HttpClient还是OkHttp？](https://juejin.cn/post/6844904040644476941)
- [Intellij IDEA 打包jar的多种方式](https://blog.csdn.net/Thousa_Ho/article/details/72799871)
- [Cannot read file within jar file](https://stackoverflow.com/questions/44411680/cannot-read-file-within-jar-file)
- [windows脚本编写及使用方法](https://blog.csdn.net/u014470361/article/details/87209079)

qiniu
- [获取域名列表](https://developer.qiniu.com/fusion/api/4246/the-domain-name#9)
- [日志下载](https://developer.qiniu.com/fusion/api/1226/download-the-log)

aliyun
- [获取用户的加速域名信息](https://help.aliyun.com/document_detail/91188.html)
  pageNumberMax：19352
- [获取加速域名的日志信息](https://help.aliyun.com/document_detail/91154.html)
  wdl1.cache.wps.cn
  sn.zichuyun.com

抓包记录
```
Frame 49: 666 bytes on wire (5328 bits), 666 bytes captured (5328 bits) on interface \Device\NPF_{489814B6-FA8D-4BF4-BD12-810B49F0AF50}, id 0
Ethernet II, Src: ASUSTekC_09:c2:07 (04:d9:f5:09:c2:07), Dst: Tp-LinkT_fb:0d:b6 (50:bd:5f:fb:0d:b6)
Internet Protocol Version 4, Src: 192.168.1.102, Dst: 106.11.172.2
Transmission Control Protocol, Src Port: 59270, Dst Port: 80, Seq: 1, Ack: 1, Len: 612
Hypertext Transfer Protocol
     [truncated]POST /?SignatureVersion=1.0&Action=DescribeUserDomains&Format=JSON&SignatureNonce=0eddb016-4e2d-428d-8da6-645cb07bf04716079164428301&Version=2018-05-10&AccessKeyId=LTAIT6vzsj5e9Dju&Signature=EvTB39edkyjI9uA4V9oq4oqbW00%3D&Sign
    Accept-Encoding: identity\r\n
    x-sdk-invoke-type: normal\r\n
    Accept: application/json\r\n
    x-sdk-client: Java/2.0.0\r\n
    User-Agent: AlibabaCloud (Windows 10; amd64) Java/1.8.0_231-b11 Core/4.4.6 HTTPClient/ApacheHttpClient\r\n
    Content-Type: application/x-www-form-urlencoded\r\n
    Host: cdn.aliyuncs.com\r\n
    Connection: Keep-Alive\r\n
    \r\n
    [Full request URI [truncated]: http://cdn.aliyuncs.com/?SignatureVersion=1.0&Action=DescribeUserDomains&Format=JSON&SignatureNonce=0eddb016-4e2d-428d-8da6-645cb07bf04716079164428301&Version=2018-05-10&AccessKeyId=LTAIT6vzsj5e9Dju&Signature]
    [HTTP request 1/1]
    [Response in frame: 52]

/?SignatureVersion=1.0&Action=DescribeUserDomains&Format=JSON&SignatureNonce=79ac4015-3e41-4309-a8b4-e98aa5dd9ed116079171433621&Version=2018-05-10&AccessKeyId=LTAIT6vzsj5e9Dju&Signature=jyBQ1jZGpAwxv0y9jSzpPQ42Xps%3D&SignatureMethod=HMAC-SHA1&RegionId=&Timestamp=2020-12-14T03%3A39%3A03Z
```

curl记录
```
C:\Users\Admin>curl -XPOST -v "http://cdn.aliyuncs.com/?AccessKeyId=LTAIT6vzsj5e9Dju&Action=DescribeUserDomains&Format=JSON&SignatureMethod=HMAC-SHA1&SignatureNonce=9b7a44b0-3be1-11e5-8c73-08002700c460&SignatureVersion=1.0&Timestamp=2020-12-14T04%3A28%3A00Z&Version=2018-05-10&Signature=/BQnaSv7ujafPmtcewAs/XqSlnc="
*   Trying 106.11.172.2...
* TCP_NODELAY set
* Connected to cdn.aliyuncs.com (106.11.172.2) port 80 (#0)
> POST /?AccessKeyId=LTAIT6vzsj5e9Dju&Action=DescribeUserDomains&Format=JSON&SignatureMethod=HMAC-SHA1&SignatureNonce=9b7a44b0-3be1-11e5-8c73-08002700c460&SignatureVersion=1.0&Timestamp=2020-12-14T04%3A28%3A00Z&Version=2018-05-10&Signature=/BQnaSv7ujafPmtcewAs/XqSlnc= HTTP/1.1
> Host: cdn.aliyuncs.com
> User-Agent: curl/7.55.1
> Accept: */*
>
< HTTP/1.1 200 OK
< Date: Mon, 14 Dec 2020 04:29:51 GMT
< Content-Type: application/json;charset=utf-8
< Content-Length: 1891
< Connection: keep-alive
< Vary: Accept-Encoding
< Access-Control-Allow-Origin: *
< Access-Control-Allow-Methods: POST, GET, OPTIONS
< Access-Control-Allow-Headers: X-Requested-With, X-Sequence, _aop_secret, _aop_signature
< Access-Control-Max-Age: 172800
< x-acs-request-id: 39A4AA26-BEDE-4451-BCCC-4C1F544098F0
<
{"Domains":{"PageData":[{"Description":"","SslProtocol":"off","ResourceGroupId":"rg-acfmvrlr5bepqyy","DomainName":"panyuan-bj.peterpy.cn","GmtModified":"2020-08-14T07:42:03Z","Coverage":"global","CdnType":"web","GmtCreated":"2020-08-14T07:35:17Z","Cname":"panyuan-bj.peterpy.cn.w.kunlungr.com","Sources":{"Source":[{"Type":"oss","Content":"panyuan-bj.oss-cn-beijing.aliyuncs.com","Priority":"20","Port":80,"Weight":"10"}]},"DomainStatus":"online","Sandbox":""},{"Description":"","SslProtocol":"off","ResourceGroupId":"rg-acfmvrlr5bepqyy","DomainName":"panyuan-bj.oss-cn-beijing.peterpy.cn","GmtModified":"2020-08-14T07:29:28Z","Coverage":"global","CdnType":"web","GmtCreated":"2020-08-14T07:25:01Z","Cname":"panyuan-bj.oss-cn-beijing.peterpy.cn.w.kunlunca.com","Sources":{"Source":[{"Type":"oss","Content":"panyuan-bj.oss-cn-beijing.aliyuncs.com","Priority":"20","Port":80,"Weight":"10"}]},"DomainStatus":"online","Sandbox":""},{"Description":"","SslProtocol":"off","ResourceGroupId":"rg-acfmvrlr5bepqyy","DomainName":".b.peterpy.cn","GmtModified":"2020-04-21T02:38:33Z","Coverage":"global","CdnType":"web","GmtCreated":"2019-09-02T03:57:15Z","Cname":"all.b.peterpy.cn.w.cdngslb.com","Sources":{"Source":[{"Type":"oss","Content":"panyuan.oss-cn-hangzhou.aliyuncs.com","Priority":"20","Port":80,"Weight":"10"}]},"DomainStatus":"online","Sandbox":""},{"Description":"粤ICP备18153746号-1","SslProtocol":"off","ResourceGroupId":"rg-acfmvrlr5bepqyy","DomainName":"oss.peterpy.cn","GmtModified":"2020-04-21T02:38:33Z","Coverage":"domestic","CdnType":"web","GmtCreated":"2019-08-08T07:51:32Z","Cname":"oss.peterpy.cn.w.kunlunca.com","Sources":{"Source":[{"Type":"oss","Content":"panyuan.oss-cn-hangzhou.aliyuncs.com","Priority":"20","Port":80,"Weight":"10"}]},"DomainStatus":"online","Sandbox":""}]},"TotalCount":4,"RequestId":"39A4AA26-BEDE-4451-BCCC-4C1F544098F0","PageSize":20,"PageNumber":1}*
Connection #0 to host cdn.aliyuncs.com left intact
```

成功记录（10个线程）
```
2020-12-15 01:23:24.430 [main] c.p.e.d.ExecuteDownLog[43] - Start to read urls from C:\Users\Admin\Desktop\urls.txt
2020-12-15 01:23:24.433 [main] c.p.e.d.ExecuteDownLog[51] - Finished reading urls from C:\Users\Admin\Desktop\urls.txt
2020-12-15 01:23:24.467 [main] c.p.e.d.ExecuteDownLog[57] - Start to download urls
...
2020-12-15 01:24:09.911 [pool-1-thread-10] c.p.e.d.ExecuteDownLogAbstract[92] - Success to download url http://cdnlog-sh-public.oss-cn-shanghai.aliyuncs.com/v1.l1cache/234581/www.abc.com/2020_12_01/www.abc.com_2020_12_01_035800_040000.gz?Expires=1608570580&OSSAccessKeyId=LTAIviCc6zy8x3xa&Signature=2H40tT7BPDWzKsSkN1AsBSXQAQA%3D size 28.43 MB
2020-12-15 01:24:10.078 [pool-1-thread-3] c.p.e.d.ExecuteDownLogAbstract[92] - Success to download url http://cdnlog2.oss-cn-hangzhou.aliyuncs.com/v1.l1cache/234581/www.abc.com/2020_12_01/www.abc.com_2020_12_01_035600_035800.gz?Expires=1608570580&OSSAccessKeyId=LTAIkNf2IHcKd0kT&Signature=ce2yfzgN5ZyA51GJhdj4y0veRpU%3D size 27.85 MB
2020-12-15 01:24:10.197 [pool-1-thread-2] c.p.e.d.ExecuteDownLogAbstract[92] - Success to download url http://cdnlog-sh-public.oss-cn-shanghai.aliyuncs.com/v1.l1cache/234581/www.abc.com/2020_12_01/www.abc.com_2020_12_01_034800_035000.gz?Expires=1608570580&OSSAccessKeyId=LTAIviCc6zy8x3xa&Signature=gQkGaqf%2BEI6Y5H6Vn3wYc1Gd2mU%3D size 29.18 MB
...
2020-12-15 01:24:10.281 [main] c.p.e.d.ExecuteDownLog[62] - Finished downloading urls
2020-12-15 01:24:10.281 [main] c.p.e.d.ExecuteDownLog[63] - TotalSize: 905.05 MB
2020-12-15 01:24:10.281 [main] c.p.e.d.ExecuteDownLog[64] - TotalTimeCost: 45.812 second
2020-12-15 01:24:10.281 [main] c.p.e.d.ExecuteDownLog[65] - AverageSpeed: 19.76 MB/s
2020-12-15 01:24:10.281 [main] c.p.e.d.ExecuteDownLog[66] - SuccessNumber: 31
2020-12-15 01:24:10.281 [main] c.p.e.d.ExecuteDownLog[67] - FailedNumber: 0
```
成功记录（1个线程）
```
2020-12-15 01:28:05.563 [main] c.p.e.d.ExecuteDownLog[62] - Finished downloading urls
2020-12-15 01:28:05.563 [main] c.p.e.d.ExecuteDownLog[63] - TotalSize: 905.05 MB
2020-12-15 01:28:05.563 [main] c.p.e.d.ExecuteDownLog[64] - TotalTimeCost: 93.691 second
2020-12-15 01:28:05.563 [main] c.p.e.d.ExecuteDownLog[65] - AverageSpeed: 9.66 MB/s
2020-12-15 01:28:05.563 [main] c.p.e.d.ExecuteDownLog[66] - SuccessNumber: 31
2020-12-15 01:28:05.563 [main] c.p.e.d.ExecuteDownLog[67] - FailedNumber: 0
```

测试结果
```
nThreads: 1
Total size: 364.95MB
Total time cost: 76.88 second

nThreads: 50
Total size: 364.95MB
Total time cost: 24.99 second

nThreads: 100
Total size: 364.95MB
Total time cost: 27.87 second

nThreads: 300
Total size: 364.95MB
Total time cost: 178.34 second
```

**Comment by peteryuanpan** [comment]
遇到了 “主线程退出，但还有用户线程未退出，导致JVM进程不马上退出” 的情况，有趣的是，大概过2-3分钟左右，进程会关闭，并发现只有在CentOS + 七牛云downlog时才会出现，在Windows上无论七牛云还是阿里云downlog都不出现，在CentOS + 阿里云downlog也不出现

再一次测试，发现CentOS + 七牛云downlog时，只有https链接会出现，http链接不会出现
从下面日志中看出有 http2 的字眼，因此猜测是基于CentOS下okhttp线程池对http2处理的一个特殊bug，[How to force the request to be HTTP/1.1](https://stackoverflow.com/questions/41925501/java-okhttp3-only-use-http-1-1-or-http-2/41931665)

进一步观察，发现阿里云日志是中是http协议，因此没走http2，然后我用 downlist 功能，测试阿里云http与https的URL下载，都无法复现异常情况

CentOS + 七牛云downlog，可复现命令：./qlogfetch2 downlog -date "2020-12-15" -domains "developer.qiniu.com" -worker 10 -dest log -overwrite

```
...
12-01-21_part-00000.gz?e=1612056649&token=557TpseUM8ovpfUhaw8gfa2DQ0104ZScM-BTIcBx:a83yIa_9CYuvEDOKUB2EOVh9ijY= size 249.03 KB
2020-12-15 15:31:26.962 [pool-1-thread-2] c.p.e.d.ExecuteDownLogAbstract[92] - Success to download url https://fusionlog.qiniu.com/v2/developer.qiniu.com_2020-12-01-17_part-00000.gz?e=1612015005&token=557TpseUM8ovpfUhaw8gfa2DQ0104ZScM-BTIcBx:ChRZyEMoCREv60JvhbvzH43R_wk= size 847.23 KB
2020-12-15 15:31:26.962 [main] c.p.e.d.ExecuteDownLog[62] - Finished downloading urls
2020-12-15 15:31:26.962 [main] c.p.e.d.ExecuteDownLog[63] - TotalSize: 9.01 MB
2020-12-15 15:31:26.962 [main] c.p.e.d.ExecuteDownLog[64] - TotalTimeCost: 1.614 second
2020-12-15 15:31:26.962 [main] c.p.e.d.ExecuteDownLog[65] - AverageSpeed: 5.58 MB/s
2020-12-15 15:31:26.963 [main] c.p.e.d.ExecuteDownLog[66] - SuccessNumber: 24
2020-12-15 15:31:26.963 [main] c.p.e.d.ExecuteDownLog[67] - FailedNumber: 0
（大概2-3分钟停在这里，然后才结束）
[root@VM-4-17-centos qiniu]#
```

jstack分析
```
[root@VM-4-17-centos ~]# jps
14679 qlogfetch2.jar
14730 Jps
[root@VM-4-17-centos ~]# jstack 14679
2020-12-15 13:11:51
Full thread dump OpenJDK 64-Bit Server VM (25.272-b10 mixed mode):

"Attach Listener" #43 daemon prio=9 os_prio=0 tid=0x00007f634c01f000 nid=0x39aa waiting on condition [0x0000000000000000]
   java.lang.Thread.State: RUNNABLE

"DestroyJavaVM" #42 prio=5 os_prio=0 tid=0x00007f637404b800 nid=0x3958 waiting on condition [0x0000000000000000]
   java.lang.Thread.State: RUNNABLE

"OkHttp Http2Connection" #40 daemon prio=5 os_prio=0 tid=0x00007f634c01d800 nid=0x397d waiting on condition [0x00007f6343ffe000]
   java.lang.Thread.State: TIMED_WAITING (parking)
        at sun.misc.Unsafe.park(Native Method)
        - parking to wait for  <0x00000000f0d8d650> (a java.util.concurrent.SynchronousQueue$TransferStack)
        at java.util.concurrent.locks.LockSupport.parkNanos(LockSupport.java:215)
        at java.util.concurrent.SynchronousQueue$TransferStack.awaitFulfill(SynchronousQueue.java:460)
        at java.util.concurrent.SynchronousQueue$TransferStack.transfer(SynchronousQueue.java:362)
        at java.util.concurrent.SynchronousQueue.poll(SynchronousQueue.java:941)
        at java.util.concurrent.ThreadPoolExecutor.getTask(ThreadPoolExecutor.java:1073)
        at java.util.concurrent.ThreadPoolExecutor.runWorker(ThreadPoolExecutor.java:1134)
        at java.util.concurrent.ThreadPoolExecutor$Worker.run(ThreadPoolExecutor.java:624)
        at java.lang.Thread.run(Thread.java:748)

"OkHttp fusionlog.qiniu.com Writer" #39 prio=5 os_prio=0 tid=0x00007f634c01c000 nid=0x397c waiting on condition [0x00007f6350173000]
   java.lang.Thread.State: WAITING (parking)
        at sun.misc.Unsafe.park(Native Method)
        - parking to wait for  <0x00000000f0d28810> (a java.util.concurrent.locks.AbstractQueuedSynchronizer$ConditionObject)
        at java.util.concurrent.locks.LockSupport.park(LockSupport.java:175)
        at java.util.concurrent.locks.AbstractQueuedSynchronizer$ConditionObject.await(AbstractQueuedSynchronizer.java:2039)
        at java.util.concurrent.ScheduledThreadPoolExecutor$DelayedWorkQueue.take(ScheduledThreadPoolExecutor.java:1081)
        at java.util.concurrent.ScheduledThreadPoolExecutor$DelayedWorkQueue.take(ScheduledThreadPoolExecutor.java:809)
        at java.util.concurrent.ThreadPoolExecutor.getTask(ThreadPoolExecutor.java:1074)
        at java.util.concurrent.ThreadPoolExecutor.runWorker(ThreadPoolExecutor.java:1134)
        at java.util.concurrent.ThreadPoolExecutor$Worker.run(ThreadPoolExecutor.java:624)
        at java.lang.Thread.run(Thread.java:748)

"OkHttp fusionlog.qiniu.com" #31 prio=5 os_prio=0 tid=0x00007f6360051000 nid=0x3973 runnable [0x00007f6350474000]
   java.lang.Thread.State: RUNNABLE
        at java.net.SocketInputStream.socketRead0(Native Method)
        at java.net.SocketInputStream.socketRead(SocketInputStream.java:116)
        at java.net.SocketInputStream.read(SocketInputStream.java:171)
        at java.net.SocketInputStream.read(SocketInputStream.java:141)
        at sun.security.ssl.SSLSocketInputRecord.read(SSLSocketInputRecord.java:457)
        at sun.security.ssl.SSLSocketInputRecord.bytesInCompletePacket(SSLSocketInputRecord.java:68)
        at sun.security.ssl.SSLSocketImpl.readApplicationRecord(SSLSocketImpl.java:1095)
        at sun.security.ssl.SSLSocketImpl.access$200(SSLSocketImpl.java:72)
        at sun.security.ssl.SSLSocketImpl$AppInputStream.read(SSLSocketImpl.java:815)
        - locked <0x00000000f65be188> (a sun.security.ssl.SSLSocketImpl$AppInputStream)
        at okio.Okio$2.read(Okio.java:140)
        at okio.AsyncTimeout$2.read(AsyncTimeout.java:237)
        at okio.RealBufferedSource.request(RealBufferedSource.java:72)
        at okio.RealBufferedSource.require(RealBufferedSource.java:65)
        at okhttp3.internal.http2.Http2Reader.nextFrame(Http2Reader.java:96)
        at okhttp3.internal.http2.Http2Connection$ReaderRunnable.execute(Http2Connection.java:600)
        at okhttp3.internal.NamedRunnable.run(NamedRunnable.java:32)
        at java.lang.Thread.run(Thread.java:748)

"Okio Watchdog" #10 daemon prio=5 os_prio=0 tid=0x00007f6374430000 nid=0x3963 in Object.wait() [0x00007f6350e7e000]
   java.lang.Thread.State: TIMED_WAITING (on object monitor)
        at java.lang.Object.wait(Native Method)
        - waiting on <0x00000000f658e218> (a java.lang.Class for okio.AsyncTimeout)
        at okio.AsyncTimeout.awaitTimeout(AsyncTimeout.java:348)
        at okio.AsyncTimeout$Watchdog.run(AsyncTimeout.java:313)
        - locked <0x00000000f658e218> (a java.lang.Class for okio.AsyncTimeout)

"OkHttp ConnectionPool" #9 daemon prio=5 os_prio=0 tid=0x00007f637442c000 nid=0x3962 in Object.wait() [0x00007f636415c000]
   java.lang.Thread.State: TIMED_WAITING (on object monitor)
        at java.lang.Object.wait(Native Method)
        - waiting on <0x00000000f6422868> (a okhttp3.internal.connection.RealConnectionPool)
        at java.lang.Object.wait(Object.java:460)
        at okhttp3.internal.connection.RealConnectionPool.lambda$new$0(RealConnectionPool.java:62)
        - locked <0x00000000f6422868> (a okhttp3.internal.connection.RealConnectionPool)
        at okhttp3.internal.connection.RealConnectionPool$$Lambda$7/977972728.run(Unknown Source)
        at java.util.concurrent.ThreadPoolExecutor.runWorker(ThreadPoolExecutor.java:1149)
        at java.util.concurrent.ThreadPoolExecutor$Worker.run(ThreadPoolExecutor.java:624)
        at java.lang.Thread.run(Thread.java:748)

"Service Thread" #7 daemon prio=9 os_prio=0 tid=0x00007f6374140800 nid=0x395f runnable [0x0000000000000000]
   java.lang.Thread.State: RUNNABLE

"C1 CompilerThread1" #6 daemon prio=9 os_prio=0 tid=0x00007f637413d800 nid=0x395e waiting on condition [0x0000000000000000]
   java.lang.Thread.State: RUNNABLE

"C2 CompilerThread0" #5 daemon prio=9 os_prio=0 tid=0x00007f637413c000 nid=0x395d waiting on condition [0x0000000000000000]
   java.lang.Thread.State: RUNNABLE

"Signal Dispatcher" #4 daemon prio=9 os_prio=0 tid=0x00007f637412d000 nid=0x395c runnable [0x0000000000000000]
   java.lang.Thread.State: RUNNABLE

"Finalizer" #3 daemon prio=8 os_prio=0 tid=0x00007f6374101800 nid=0x395b in Object.wait() [0x00007f6364c2b000]
   java.lang.Thread.State: WAITING (on object monitor)
        at java.lang.Object.wait(Native Method)
        - waiting on <0x00000000f5bb6848> (a java.lang.ref.ReferenceQueue$Lock)
        at java.lang.ref.ReferenceQueue.remove(ReferenceQueue.java:144)
        - locked <0x00000000f5bb6848> (a java.lang.ref.ReferenceQueue$Lock)
        at java.lang.ref.ReferenceQueue.remove(ReferenceQueue.java:165)
        at java.lang.ref.Finalizer$FinalizerThread.run(Finalizer.java:216)

"Reference Handler" #2 daemon prio=10 os_prio=0 tid=0x00007f63740fc800 nid=0x395a in Object.wait() [0x00007f6364d2c000]
   java.lang.Thread.State: WAITING (on object monitor)
        at java.lang.Object.wait(Native Method)
        - waiting on <0x00000000f5bb6a00> (a java.lang.ref.Reference$Lock)
        at java.lang.Object.wait(Object.java:502)
        at java.lang.ref.Reference.tryHandlePending(Reference.java:191)
        - locked <0x00000000f5bb6a00> (a java.lang.ref.Reference$Lock)
        at java.lang.ref.Reference$ReferenceHandler.run(Reference.java:153)

"VM Thread" os_prio=0 tid=0x00007f63740f3000 nid=0x3959 runnable

"VM Periodic Task Thread" os_prio=0 tid=0x00007f6374143800 nid=0x3960 waiting on condition

JNI global references: 266

[root@VM-4-17-centos ~]# jps
15485 Jps
```
